{
  "schemaVersion": "ub4-perf-baseline-receipt/v1",
  "resultPath": "benchmarks/results/ub4-perf-baseline-2026-07-25-darwin-arm64-rereview.json",
  "resultSha256": "bf6c375535746908ba12ab0e0d73393a8bd2f2e72aaceeb956df18463ef14314",
  "capturedAt": "2026-07-26T06:21:41.155Z",
  "sourceWindow": {
    "before": {
      "commit": "8eee967a521f4f4f6b22e642916ca2535b8c3c84",
      "dirty": {
        "isDirty": true,
        "changedPathCount": 108,
        "statusNulSha256": "5a8b8dcb59fad486bce0107c2f0f532c2ea9efc1fdd6aa9e60dae2f4ffdb737d"
      }
    },
    "after": {
      "commit": "8eee967a521f4f4f6b22e642916ca2535b8c3c84",
      "dirty": {
        "isDirty": true,
        "changedPathCount": 108,
        "statusNulSha256": "5a8b8dcb59fad486bce0107c2f0f532c2ea9efc1fdd6aa9e60dae2f4ffdb737d"
      }
    },
    "stable": true
  },
  "buildProvenance": {
    "status": "blocked",
    "blocker": "This capture fingerprints stable prebuilt outputs but has no isolated source-to-output build receipt; build-dependent release budgets remain blocked.",
    "modules": [
      {
        "path": "lib/commonjs/encoding.js",
        "before": {
          "bytes": 2753,
          "sha256": "146e246f504f5d4e01b20116e1f6a97f7064ff53c402a1e7d9234109b3984065"
        },
        "after": {
          "bytes": 2753,
          "sha256": "146e246f504f5d4e01b20116e1f6a97f7064ff53c402a1e7d9234109b3984065"
        }
      },
      {
        "path": "lib/commonjs/port/BlePort.js",
        "before": {
          "bytes": 13628,
          "sha256": "8eddb1042cb95332446250f79a162e3ec4f3b1db3bffc5927504c7109ddbf3f3"
        },
        "after": {
          "bytes": 13628,
          "sha256": "8eddb1042cb95332446250f79a162e3ec4f3b1db3bffc5927504c7109ddbf3f3"
        }
      },
      {
        "path": "lib/commonjs/port/PortBleManager.js",
        "before": {
          "bytes": 22275,
          "sha256": "b1d3d96dea636d5e0598dd373911ba4508b573ce386ad6f7a05cc6fd63f60fd5"
        },
        "after": {
          "bytes": 22275,
          "sha256": "b1d3d96dea636d5e0598dd373911ba4508b573ce386ad6f7a05cc6fd63f60fd5"
        }
      },
      {
        "path": "lib/commonjs/DeviceOperationQueue.js",
        "before": {
          "bytes": 7673,
          "sha256": "28849280696ae9cfd6215d557880f71ac904011b24998c87032acbe5d83d777a"
        },
        "after": {
          "bytes": 7673,
          "sha256": "28849280696ae9cfd6215d557880f71ac904011b24998c87032acbe5d83d777a"
        }
      },
      {
        "path": "native/electron/corebluetooth/index.js",
        "before": {
          "bytes": 9687,
          "sha256": "3d682dd8dbff245cdf123dd179e089bb3d0e3bf663e7f888173c2555594d87c9"
        },
        "after": {
          "bytes": 9687,
          "sha256": "3d682dd8dbff245cdf123dd179e089bb3d0e3bf663e7f888173c2555594d87c9"
        }
      },
      {
        "path": "native/electron/corebluetooth/build/Release/unified_ble_corebluetooth.node",
        "before": {
          "bytes": 222384,
          "sha256": "e86ce32fa04668a9102f8e92a784fecdf6a73efa50a2e0a8ff197e65c10c2cfb"
        },
        "after": {
          "bytes": 222384,
          "sha256": "e86ce32fa04668a9102f8e92a784fecdf6a73efa50a2e0a8ff197e65c10c2cfb"
        }
      }
    ]
  }
}
